title;price;zalog;animals;condition;seller;date;address;technics;description;url;rand_header
Дом 32 м² на участке 1 сот.;16000;залог 32 000 ₽;not found;нет;Арендодатель;29 марта в 12:53;Краснодарский край, Краснодар;not found;Сдаю 2к дом частный,  туалет на улице отдельный. В доме душевая, кухня, техника есть. В аренду входит коммуналка. Остальные вопросы по телефону, по аренде можно поторговаться.;https://www.avito.ru/krasnodar/doma_dachi_kottedzhi/dom_32_m_na_uchastke_1_sot._2369893648;"{'user-agent': 'Mozilla/5.0 (Windows NT 10.0; Win64; x64) AppleWebKit/537.36 (KHTML, like Gecko) Chrome/99.0.4844.82 Safari/537.36', 'accept': '*/*', 'accept-language': 'ru,en-US;q=0.9,en;q=0.8'}"
Дом 25 м² на участке 1 сот.;15000;залог 15 000 ₽;нет;нет;Агентство;27 марта в 17:11;Краснодарский край, Краснодар, Центральный внутригородской округ, микрорайон Центральный, ул. Кирова, 35;холодильник, плита, стиральная машина, водонагреватель, телевизор;СОБСТВЕННИК ! В самом центре города ! Сдам жакт на длительный срок , все необходимое для проживания имеется , залог обязательно + коммуналка  , остальные вопросы по телефону;https://www.avito.ru/krasnodar/doma_dachi_kottedzhi/dom_25_m_na_uchastke_1_sot._2349238431;"{'user-agent': 'Mozilla/5.0 (Windows NT 10.0; Win64; x64) AppleWebKit/537.36 (KHTML, like Gecko) Chrome/99.0.4844.82 Safari/537.36', 'accept': '*/*', 'accept-language': 'ru,en-US;q=0.9,en;q=0.8'}"
Дом 45 м² на участке 3 сот.;14000;залог 7 000 ₽;нет;да;Арендодатель;24 марта в 00:53;Краснодарский край, Краснодар, ул. Гагарина;кондиционер, холодильник, плита, микроволновка, стиральная машина, водонагреватель, телевизор, утюг;Дом состоит из 2 раздельных комнат.(одна комната 14кв.м .,вторая 18 кв .м.комнаты раздельные ) В доме есть душевая кабина туалет во дворе .(есть БИО туалет в доме) Есть два  дивана , мебель, пылесос, телевизор,микроволновка,холодильник,  стиральная машина  ,кондиционер Все ,что на фото это реально,.В доме чисто и уютно !!!!Зимой  в  доме тепло !!!Для машины есть парковочное  место. Двор выложен  плиткой.Без животных собак и кошек.В шаговой доступности две школы.парк Дендрарий (где живут белочки,павлины ) редкий вид деревьев.В парке занимаются спортом бегают, есть трек для велоспорта.,гуляют с детьми Место тихое ,безопасное ,есть охрана.Рядом магазины Магнит  ,Табрис. .Мясной Мир ,Все виды транспорта .трамвай , троллейбус ,автобусы, Все в шаговой доступности !!!! Дом сдаю на длительный срок !!!! ХОЗЯЙКА..;https://www.avito.ru/krasnodar/doma_dachi_kottedzhi/dom_45_m_na_uchastke_3_sot._1962290052;"{'user-agent': 'Mozilla/5.0 (Windows NT 10.0; Win64; x64; rv:98.0) Gecko/20100101 Firefox/98.0', 'accept': 'image/avif,image/webp,*/*', 'accept-language': 'ru-RU,ru;q=0.8,en-US;q=0.5,en;q=0.3'}"
Дом 47 м² на участке 3 сот.;14000;залог 14 000 ₽, без комиссии;да;нет;Арендодатель;10 марта в 10:16;Республика Адыгея, Тахтамукайский р-н, Старобжегокайское сельское поселение, аул Новая Адыгея, Сквозная ул.;холодильник, плита, стиральная машина;Сдам часть дома. ПРОЖИВАНИЕ БЕЗ ХОЗЯЕВ, ХОРОШИЕ СОСЕДИ. Отдельный вход, двор с парковочным местом. Спальня, кухня-столовая, санузел. Расположение: Новая Адыгея (ул.Сквозная), до центра Краснодара 30 мин.;https://www.avito.ru/krasnodar/doma_dachi_kottedzhi/dom_47_m_na_uchastke_3_sot._2349868927;"{'user-agent': 'Mozilla/5.0 (Windows NT 10.0; Win64; x64; rv:98.0) Gecko/20100101 Firefox/98.0', 'accept': 'image/avif,image/webp,*/*', 'accept-language': 'ru-RU,ru;q=0.8,en-US;q=0.5,en;q=0.3'}"
Дом 55 м² на участке 3 сот.;8000;залог 4 000 ₽;да;нет;Агентство;30 марта в 21:25;Краснодарский край, Краснодар, Фестивальный микрорайон, Малороссийский пр., 3;холодильник, плита, микроволновка, стиральная машина, телевизор;Сдается дом для рабочих, строителей, в центре (Аврора, ФМР). В доме есть все удобства, необходимая мебель и бытовая техника. Удобный и быстрый проезд в любую часть Краснодара. Рядом Семейный магнит. Коммунальные включены в стоимость. Оплата-4000рублей с человека в месяц.;https://www.avito.ru/krasnodar/doma_dachi_kottedzhi/dom_55_m_na_uchastke_3_sot._457668448;"{'user-agent': 'Mozilla/5.0 (Windows NT 10.0; Win64; x64) AppleWebKit/537.36 (KHTML, like Gecko) Chrome/99.0.4844.82 Safari/537.36', 'accept': '*/*', 'accept-language': 'ru,en-US;q=0.9,en;q=0.8'}"
Дом 50 м² на участке 6 сот.;15000;залог 15 000 ₽, комиссия 7 500 ₽;нет;нет;Агентство;14 марта в 14:02;Краснодарский край, Краснодар, Карасунский внутригородской округ, жилой массив Пашковский;плита;Сдаю часть дома (2 комнаты). По улице 1 го Мая, Пашковка. В доме сделан свежий ремонт, без мебели. Семейным людям на длительный срок.;https://www.avito.ru/krasnodar/doma_dachi_kottedzhi/dom_50_m_na_uchastke_6_sot._2339279156;"{'User-Agent': 'Mozilla/5.0 (X11; Ubuntu; Linux x86_64; rv:98.0) Gecko/20100101 Firefox/98.0', 'Accept': 'image/avif,image/webp,*/*', 'Accept-Language': 'ru-RU,ru;q=0.8,en-US;q=0.5,en;q=0.3'}"
Дом 45 м² на участке 1 сот.;15000;без залога;нет;нет;Арендодатель;23 марта в 18:51;Краснодарский край, Краснодар, Центральный внутригородской округ, микрорайон Центральный, Длинная ул., 6;холодильник, плита, микроволновка, водонагреватель, телевизор;Две комнаты изолированные. Кухня санузел прихожая для одной или двух девочек;https://www.avito.ru/krasnodar/doma_dachi_kottedzhi/dom_45_m_na_uchastke_1_sot._2351845676;"{'User-Agent': 'Mozilla/5.0 (X11; Ubuntu; Linux x86_64; rv:98.0) Gecko/20100101 Firefox/98.0', 'Accept': 'image/avif,image/webp,*/*', 'Accept-Language': 'ru-RU,ru;q=0.8,en-US;q=0.5,en;q=0.3'}"
Дом 80 м² на участке 5 сот.;10000;залог 5 000 ₽, комиссия 5 000 ₽;да;нет;Агентство;9 марта в 13:50;Краснодарский край, Краснодар, ул. имени В.Н. Мачуги, 124;плита;читаем внимательно без воды Сдается дом  без мебели залог 5 т руб возможно под коммерциюФото соответствуютСдает агенство 5000 руб по факту заселения;https://www.avito.ru/krasnodar/doma_dachi_kottedzhi/dom_80_m_na_uchastke_5_sot._2126283657;"{'user-agent': 'Mozilla/5.0 (Windows NT 10.0; Win64; x64; rv:98.0) Gecko/20100101 Firefox/98.0', 'accept': 'image/avif,image/webp,*/*', 'accept-language': 'ru-RU,ru;q=0.8,en-US;q=0.5,en;q=0.3'}"
Дом 20 м² на участке 1 сот.;10000;без залога;нет;нет;Арендодатель;8 марта в 18:50;Краснодарский край, Краснодар, микрорайон Хлопчато-бумажный Комбинат, 1-й Дунайский пр., 4;not found;10тыс+коммунальные,МОЖНО ПОСУТОЧНО цена договорная,есть ещё варианты во дворе.ДЛЯ РЕБЯТ.;https://www.avito.ru/krasnodar/doma_dachi_kottedzhi/dom_20_m_na_uchastke_1_sot._1780275454;"{'user-agent': 'Mozilla/5.0 (Windows NT 10.0; Win64; x64; rv:98.0) Gecko/20100101 Firefox/98.0', 'accept': 'image/avif,image/webp,*/*', 'accept-language': 'ru-RU,ru;q=0.8,en-US;q=0.5,en;q=0.3'}"
Дом 30 м² на участке 2 сот.;16000;без залога, комиссия 4 800 ₽;нет;нет;Агентство;16 марта в 19:08;Краснодарский край, Краснодар, Карасунский внутригородской округ, микрорайон Камвольно-суконный Комбинат, Ремесленная ул., 65;not found;Сдается 1/2дома ,три смежные комнаты,кухня, санузел.Три спальных места, холодильник, телевизор, стиральная машина автомат.Отдельный вход,свой дворик,машину можно ставить на улице перед домом.Связь работает плохо, пишет.;https://www.avito.ru/krasnodar/doma_dachi_kottedzhi/dom_30_m_na_uchastke_2_sot._2266079240;"{'user-agent': 'Mozilla/5.0 (Windows NT 10.0; Win64; x64) AppleWebKit/537.36 (KHTML, like Gecko) Chrome/99.0.4844.82 Safari/537.36', 'accept': '*/*', 'accept-language': 'ru,en-US;q=0.9,en;q=0.8'}"
Дом 20 м² на участке 4 сот.;14000;без залога;нет;нет;Арендодатель;10 марта в 12:58;Краснодарский край, Краснодар, Российский пр., 47;not found;Сдам маленький домик,на территории хозяина,Кухня летняя отдельно на территории ,туалет на первом этаже ,сдается для одного человека ,могу предложить работу водителем Газели там же оплата 30.000 +подработка.;https://www.avito.ru/krasnodar/doma_dachi_kottedzhi/dom_20_m_na_uchastke_4_sot._2211985102;"{'user-agent': 'Mozilla/5.0 (Windows NT 10.0; Win64; x64) AppleWebKit/537.36 (KHTML, like Gecko) Chrome/99.0.4844.82 Safari/537.36', 'accept': '*/*', 'accept-language': 'ru,en-US;q=0.9,en;q=0.8'}"
Дом 30 м² на участке 48 сот.;7000;залог 21 000 ₽;да;нет;Арендодатель;9 марта в 23:58;Республика Адыгея, Тахтамукайский р-н, аул Афипсип, Извилистая ул., 9;плита, стиральная машина;Сдается жильё все вопросы по телефону. Цена за ж;https://www.avito.ru/krasnodar/doma_dachi_kottedzhi/dom_30_m_na_uchastke_48_sot._2208061913;"{'User-Agent': 'Mozilla/5.0 (X11; Ubuntu; Linux x86_64; rv:98.0) Gecko/20100101 Firefox/98.0', 'Accept': 'image/avif,image/webp,*/*', 'Accept-Language': 'ru-RU,ru;q=0.8,en-US;q=0.5,en;q=0.3'}"
